### ISSUE TITLE
HAPROXY建连失败

### ISSUE THREAD

**Issue by yun1989yue** [pingcap/docs-cn#16843]
File: [/release-7.5/best-practices/haproxy-best-practices.md](https://docs.pingcap.com/zh/tidb/stable/haproxy-best-practices)

你好，按照文档部署haproxy成功后，haproxy监听端口3390和8080，tidb集群也通过tiup建立成功，监听端口4000。但是两者之间没有建立连接，并且mysql可以直接访问tidb，但是访问haproxy会报错。
mysql: [Warning] Using a password on the command line interface can be insecure.
ERROR 2013 (HY000): Lost connection to MySQL server at 'reading authorization packet', system error: 0

1. haproxy的配置文件设置了
server tidb-1 192.168.1.178:4000 check inter 2000 rise 2 fall 3

2. tiup的拓扑文件设置了
server_configs:
  tidb:
    proxy-protocol.networks: 192.168.1.185

3. haproxy和tidb使用telnet确认双方端口是互通的

4. 通过tcpdump抓包可以看到haproxy和tidb之间不断的尝试tcp握手建连
# proxy端如下
16:46:13.920826 IP iZ2zed5y31lymhmjx6zgzlZ.45594 > 192.168.1.178.terabase: Flags [S], seq 310027706, win 64240, options [mss 1460,sackOK,TS val 3601087684 ecr 0,nop,wscale 7], length 0
16:46:13.920997 IP 192.168.1.178.terabase > iZ2zed5y31lymhmjx6zgzlZ.45594: Flags [S.], seq 859867570, ack 310027707, win 65160, options [mss 1460,sackOK,TS val 2032876669 ecr 3601087684,nop,wscale 7], length 0
16:46:13.921028 IP iZ2zed5y31lymhmjx6zgzlZ.45594 > 192.168.1.178.terabase: Flags [R.], seq 1, ack 1, win 502, options [nop,nop,TS val 3601087684 ecr 2032876669], length 0
# tidb端如下
16:52:10.226475 IP 192.168.1.185.59578 > iZ2ze5q5xqz22ma2rn6y6zZ.terabase: Flags [S], seq 331562225, win 64240, options [mss 1460,sackOK,TS val 3601443988 ecr 0,nop,wscale 7], length 0
16:52:10.226500 IP iZ2ze5q5xqz22ma2rn6y6zZ.terabase > 192.168.1.185.59578: Flags [S.], seq 2412985930, ack 331562226, win 65160, options [mss 1460,sackOK,TS val 2033232974 ecr 3601443988,nop,wscale 7], length 0
16:52:10.226640 IP 192.168.1.185.59578 > iZ2ze5q5xqz22ma2rn6y6zZ.terabase: Flags [R.], seq 1, ack 1, win 502, options [nop,nop,TS val 3601443989 ecr 2033232974], length 0

5. 也尝试了关闭防火墙，但是没什么效果
还需要做什么才能让haproxy和tidb之间建立连接呢？

**Comment by yun1989yue** [comment]
完整的haproxy配置文件如下
# cat /etc/haproxy/haproxy.cfg
global                                     # 全局配置。
   log         127.0.0.1 local2 debug            # 定义全局的 syslog 服务器，最多可以定义两个。
   chroot      /var/lib/haproxy            # 更改当前目录并为启动进程设置超级用户权限，从而提高安全性。
   pidfile     /var/run/haproxy.pid        # 将 HAProxy 进程的 PID 写入 pidfile。
   maxconn     4096                        # 单个 HAProxy 进程可接受的最大并发连接数，等价于命令行参数 "-n"。
   nbthread    32                          # 最大线程数。线程数的上限与 CPU 数量相同。
   user        haproxy                     # 同 UID 参数。
   group       haproxy                     # 同 GID 参数，建议使用专用用户组。
   daemon                                  # 让 HAProxy 以守护进程的方式工作于后台，等同于命令行参数“-D”的功能。当然，也可以在命令行中用“-db”参数将其禁用。
   stats socket /var/lib/haproxy/stats     # 统计信息保存位置。

defaults                                   # 默认配置。
   log global                              # 日志继承全局配置段的设置。
   retries 2                               # 向上游服务器尝试连接的最大次数，超过此值便认为后端服务器不可用。
   timeout connect  2s                     # HAProxy 与后端服务器连接超时时间。如果在同一个局域网内，可设置成较短的时间。
   timeout client 30000s                   # 客户端与 HAProxy 连接后，数据传输完毕，即非活动连接的超时时间。
   timeout server 30000s                   # 服务器端非活动连接的超时时间。

listen admin_stats                         # frontend 和 backend 的组合体，此监控组的名称可按需进行自定义。
   bind 0.0.0.0:8080                       # 监听端口。
   mode http                               # 监控运行的模式，此处为 `http` 模式。
   option httplog                          # 开始启用记录 HTTP 请求的日志功能。
   maxconn 10                              # 最大并发连接数。
   stats refresh 30s                       # 每隔 30 秒自动刷新监控页面。
   stats uri /haproxy                      # 监控页面的 URL。
   stats realm HAProxy                     # 监控页面的提示信息。
   stats auth admin:pingcap123             # 监控页面的用户和密码，可设置多个用户名。
   stats hide-version                      # 隐藏监控页面上的 HAProxy 版本信息。
   stats  admin if TRUE                    # 手工启用或禁用后端服务器（HAProxy 1.4.9 及之后版本开始支持）。

listen tidb-cluster                        # 配置 database 负载均衡。
   bind 0.0.0.0:3390                       # 浮动 IP 和 监听端口。
   mode tcp                                # HAProxy 要使用第 4 层的传输层。
   balance leastconn                       # 连接数最少的服务器优先接收连接。`leastconn` 建议用于长会话服务，例如 LDAP、SQL、TSE 等，而不是短会话协议，如 HTTP。该算法是动态的，对于启动慢的服务器，服务器权重会在运行中作调整。
   server tidb-1 192.168.1.178:4000 check inter 2000 rise 2 fall 3       # 检测 4000 端口，检测频率为每 2000 毫秒一次。如果 2 次检测为成功，则认为服务器可用；如果 3 次检测为失败，则认为服务器不可用。
   server tidb-2 192.168.1.179:4000 check inter 2000 rise 2 fall 3

**Comment by xhebox** [comment]
> server tidb-1 192.168.1.178:4000 check inter 2000 rise 2 fall 3

Try adding `send-proxy` as in the documentation.
